{
  "api_version": "1.0",
  "operation": "prepare",
  "status": "ok",
  "code": "OK",
  "message": "命令成功。",
  "data": {
    "stage": "prepared",
    "style_id": "Aix0052",
    "style_name": "深蓝夜半手机",
    "style_version": "1.0.0",
    "thumbnail_path": "styles/Aix0052/thumbnail.webp",
    "target": "generic-text-v1",
    "mode": "generate",
    "strength": "balanced",
    "final_prompt": "画面内容：夜半坐起的人影在床边看手机\n必须保留：夜半人影；手机\n视觉风格：数字平涂结合硬边线稿；深蓝调底配粉色光照与黑灰设备；手机屏幕的局部光照亮手部；特写对角构图，桌面元素铺陈；轻微数字噪点\n画幅比例：2:3\n避免出现：多光源；喧嚣场景；乱码文字与伪文字",
    "negative_prompt": null,
    "requested_parameters": {
      "aspect_ratio": "2:3"
    },
    "tool_parameters": {},
    "applied_feature_ids": [
      "F01",
      "F02",
      "F03",
      "F04",
      "F05"
    ],
    "omitted_features": [],
    "omitted_avoid": [],
    "provenance": {
      "style_id": "Aix0052",
      "style_version": "1.0.0",
      "library_version": "0.3.2",
      "content_hash": "5e898ca044c3883c0a9a560f2eaecb96811c37d82b1179aca06d7e08a3d3c4ef"
    }
  },
  "warnings": [],
  "meta": {
    "library_version": "0.3.2",
    "execution_mode": "script",
    "elapsed_ms": 1
  }
}