{
  "api_version": "1.0",
  "operation": "prepare",
  "status": "ok",
  "code": "OK",
  "message": "命令成功。",
  "data": {
    "stage": "prepared",
    "style_id": "Aix0029",
    "style_name": "紫蓝鱼眼透视",
    "style_version": "1.0.0",
    "thumbnail_path": "styles/Aix0029/thumbnail.webp",
    "target": "generic-text-v1",
    "mode": "generate",
    "strength": "balanced",
    "final_prompt": "画面内容：清晨空旷的立交桥，延伸到地平线\n必须保留：立交桥；清晨\n视觉风格：3D 渲染质感，写实材质与景深；鱼眼式极端透视，前景物体夸张放大；紫蓝渐变色调，晨昏青色调；逆光半剪影，边缘光勾勒轮廓；金属与路面的写实细节\n画幅比例：2:3\n避免出现：平涂卡通；高饱和霓虹；乱码文字与伪文字",
    "negative_prompt": null,
    "requested_parameters": {
      "aspect_ratio": "2:3"
    },
    "tool_parameters": {},
    "applied_feature_ids": [
      "F01",
      "F02",
      "F03",
      "F04",
      "F05"
    ],
    "omitted_features": [],
    "omitted_avoid": [],
    "provenance": {
      "style_id": "Aix0029",
      "style_version": "1.0.0",
      "library_version": "0.3.2",
      "content_hash": "a367656a0aea4acd83ff047ce00ba25379b165de2d27ea5f486ef8f71c051170"
    }
  },
  "warnings": [],
  "meta": {
    "library_version": "0.3.2",
    "execution_mode": "script",
    "elapsed_ms": 1
  }
}