{
  "api_version": "1.0",
  "operation": "prepare",
  "status": "ok",
  "code": "OK",
  "message": "命令成功。",
  "data": {
    "stage": "prepared",
    "style_id": "Aix0071",
    "style_name": "冷蓝折阶孤行",
    "style_version": "1.0.0",
    "thumbnail_path": "styles/Aix0071/thumbnail.webp",
    "target": "generic-text-v1",
    "mode": "generate",
    "strength": "balanced",
    "final_prompt": "画面内容：枯树与折线高架桥组成的冷蓝城市边缘\n必须保留：枯树；高架桥\n视觉风格：粗颗粒数字厚涂，边缘保留不规则笔触；深蓝灰与紫蓝冷色为主，局部冷光提亮；折返几何路径形成强烈的纵向引导线；低照度漫射光，亮部集中在路径边缘；岩石般粗糙颗粒与轻微星尘斑点\n画幅比例：2:3\n避免出现：光滑商业插画；明亮糖果色与复杂暖光；乱码文字与伪文字",
    "negative_prompt": null,
    "requested_parameters": {
      "aspect_ratio": "2:3"
    },
    "tool_parameters": {},
    "applied_feature_ids": [
      "F01",
      "F02",
      "F03",
      "F04",
      "F05"
    ],
    "omitted_features": [],
    "omitted_avoid": [],
    "provenance": {
      "style_id": "Aix0071",
      "style_version": "1.0.0",
      "library_version": "0.4.1",
      "content_hash": "cb804ac2d2b7a09d18c5d4f76b00e7a7b39789031c5f6747af8e54af052f71eb"
    }
  },
  "warnings": [],
  "meta": {
    "library_version": "0.4.1",
    "execution_mode": "script",
    "elapsed_ms": 1
  }
}