{
  "api_version": "1.0",
  "operation": "prepare",
  "status": "ok",
  "code": "OK",
  "message": "命令成功。",
  "data": {
    "stage": "prepared",
    "style_id": "Aix0128",
    "style_name": "百面阶梯",
    "style_version": "1.0.0",
    "thumbnail_path": "styles/Aix0128/thumbnail.webp",
    "target": "generic-text-v1",
    "mode": "generate",
    "strength": "balanced",
    "final_prompt": "画面内容：侧身或背影人物与楼梯与重复面孔形成强烈的方向或尺度关系，留出负空间，延续重复面孔节奏。\n必须保留：蓝黑白；重复面孔节奏\n视觉风格：清晰漫画线条结合平涂块面，重复面孔只需概括表情结构。；冷蓝背景、黑衣和白脸形成有限三色关系。；楼梯提供纵深，重复面孔围成包围式节奏，主体保持单一焦点。；均匀冷光，不用戏剧性写实阴影破坏漫画平面。；纸面颗粒、线稿抖动和少量套印偏移。\n画幅比例：2:3\n避免出现：每张脸都写实细描；欢快糖果色；乱码文字与伪文字",
    "negative_prompt": null,
    "requested_parameters": {
      "aspect_ratio": "2:3"
    },
    "tool_parameters": {},
    "applied_feature_ids": [
      "F01",
      "F02",
      "F03",
      "F04",
      "F05"
    ],
    "omitted_features": [],
    "omitted_avoid": [],
    "provenance": {
      "style_id": "Aix0128",
      "style_version": "1.0.0",
      "library_version": "0.6.0",
      "content_hash": "8baa88c4e3a1f59cab07bbebfdc007014a5bb53e5cab3a17e6c89de7b6110786"
    }
  },
  "warnings": [],
  "meta": {
    "library_version": "0.6.0",
    "execution_mode": "script",
    "elapsed_ms": 1
  }
}