{
  "api_version": "1.0",
  "operation": "prepare",
  "status": "ok",
  "code": "OK",
  "message": "命令成功。",
  "data": {
    "stage": "prepared",
    "style_id": "Aix0061",
    "style_name": "蓝白飞鸟升空",
    "style_version": "1.0.0",
    "thumbnail_path": "styles/Aix0061/thumbnail.webp",
    "target": "generic-text-v1",
    "mode": "generate",
    "strength": "balanced",
    "final_prompt": "画面内容：天空之下，鸟群组成的路径通向云端\n必须保留：天空；鸟群\n视觉风格：数字笔触结合矢量流线，轻重对比；天蓝背景配深蓝衣物与纯白飞鸟；均匀柔和光，鸟群自带高光；中心向上发散的升腾构图；平滑净润，细节处留笔触\n画幅比例：2:3\n避免出现：暗黑压抑；粗颗粒；乱码文字与伪文字",
    "negative_prompt": null,
    "requested_parameters": {
      "aspect_ratio": "2:3"
    },
    "tool_parameters": {},
    "applied_feature_ids": [
      "F01",
      "F02",
      "F03",
      "F04",
      "F05"
    ],
    "omitted_features": [],
    "omitted_avoid": [],
    "provenance": {
      "style_id": "Aix0061",
      "style_version": "1.0.0",
      "library_version": "0.3.2",
      "content_hash": "46ed3909d58709b4faba7ea93d5963b85440558a3b9502b6d815da7b90e22d2a"
    }
  },
  "warnings": [],
  "meta": {
    "library_version": "0.3.2",
    "execution_mode": "script",
    "elapsed_ms": 1
  }
}