{
  "api_version": "1.0",
  "operation": "prepare",
  "status": "ok",
  "code": "OK",
  "message": "命令成功。",
  "data": {
    "stage": "prepared",
    "style_id": "Aix0018",
    "style_name": "图腾奇幻厚涂",
    "style_version": "1.0.0",
    "thumbnail_path": "styles/Aix0018/thumbnail.webp",
    "target": "generic-text-v1",
    "mode": "generate",
    "strength": "balanced",
    "final_prompt": "画面内容：刻满纹样的木箱与陶罐\n必须保留：木箱；陶罐\n视觉风格：橙红与土黄暖色同深海军蓝冷色强互补撞色；戏剧性底光与聚光，暖光自下方照亮主体下缘与地面光斑；中心对称主体，背景满构图密集排列的矩形纹样墙；干刷质感数字厚涂，边缘块面化，带木刻版画味；做旧纸张与粗糙肌理，颗粒覆盖全画\n画幅比例：2:3\n避免出现：干净光滑的矢量质感；写实写生光影与大面积留白；乱码文字与伪文字",
    "negative_prompt": null,
    "requested_parameters": {
      "aspect_ratio": "2:3"
    },
    "tool_parameters": {},
    "applied_feature_ids": [
      "F01",
      "F02",
      "F03",
      "F04",
      "F05"
    ],
    "omitted_features": [],
    "omitted_avoid": [],
    "provenance": {
      "style_id": "Aix0018",
      "style_version": "1.0.0",
      "library_version": "0.2.0",
      "content_hash": "cf6f6ea7702b8205be4affcf4cfc7d02044b4f73d258f56876fdd3e91f8ff1b9"
    }
  },
  "warnings": [],
  "meta": {
    "library_version": "0.2.0",
    "execution_mode": "script",
    "elapsed_ms": 1
  }
}