{
  "api_version": "1.0",
  "operation": "prepare",
  "status": "ok",
  "code": "OK",
  "message": "命令成功。",
  "data": {
    "stage": "prepared",
    "style_id": "Aix0081",
    "style_name": "冷蓝阴影巨物",
    "style_version": "1.0.0",
    "thumbnail_path": "styles/Aix0081/thumbnail.webp",
    "target": "generic-text-v1",
    "mode": "generate",
    "strength": "balanced",
    "final_prompt": "画面内容：戴帽子的行者站在门口，身后的影子比建筑还高\n必须保留：行者；高大影子\n视觉风格：清晰线稿结合动画式硬边赛璐璐色块；冷蓝灰环境与纯黑阴影，单点红色聚焦；上方巨形压境、下方小人物形成极端比例；侧向强光把普通物体投射成夸张阴影；平滑动画质感，背景保留轻微颗粒\n画幅比例：2:3\n避免出现：写实血腥恐怖；暖色明亮日常；乱码文字与伪文字",
    "negative_prompt": null,
    "requested_parameters": {
      "aspect_ratio": "2:3"
    },
    "tool_parameters": {},
    "applied_feature_ids": [
      "F01",
      "F02",
      "F03",
      "F04",
      "F05"
    ],
    "omitted_features": [],
    "omitted_avoid": [],
    "provenance": {
      "style_id": "Aix0081",
      "style_version": "1.0.0",
      "library_version": "0.4.1",
      "content_hash": "a02f3d446a8e1f38e309a15abbcdc08d0600a1cd366a38684ebcc99f52bdf257"
    }
  },
  "warnings": [],
  "meta": {
    "library_version": "0.4.1",
    "execution_mode": "script",
    "elapsed_ms": 1
  }
}