{
  "api_version": "1.0",
  "operation": "prepare",
  "status": "ok",
  "code": "OK",
  "message": "命令成功。",
  "data": {
    "stage": "prepared",
    "style_id": "Aix0095",
    "style_name": "星尘祈手",
    "style_version": "1.0.0",
    "thumbnail_path": "styles/Aix0095/thumbnail.webp",
    "target": "generic-text-v1",
    "mode": "generate",
    "strength": "balanced",
    "final_prompt": "画面内容：戴手套的手从黑色水面伸向一颗冷白星球\n必须保留：手；冷白星球\n视觉风格：数字合成或三维粒子渲染，主体边缘由颗粒组成；纯黑背景与白蓝星尘，边缘带少量红色反光；垂直向上手势占据中心，光束呈放射状；强烈顶光或逆光，形成清晰体积光柱；沙粒、星点和雾化光晕叠加\n画幅比例：2:3\n避免出现：平面无光影插画；明亮复杂背景；乱码文字与伪文字",
    "negative_prompt": null,
    "requested_parameters": {
      "aspect_ratio": "2:3"
    },
    "tool_parameters": {},
    "applied_feature_ids": [
      "F01",
      "F02",
      "F03",
      "F04",
      "F05"
    ],
    "omitted_features": [],
    "omitted_avoid": [],
    "provenance": {
      "style_id": "Aix0095",
      "style_version": "1.0.0",
      "library_version": "0.4.1",
      "content_hash": "eac2b5de806411a9fa480d42bba4773965f6e995ce7b53a09985bde0fae13958"
    }
  },
  "warnings": [],
  "meta": {
    "library_version": "0.4.1",
    "execution_mode": "script",
    "elapsed_ms": 1
  }
}