{
  "api_version": "1.0",
  "operation": "prepare",
  "status": "ok",
  "code": "OK",
  "message": "命令成功。",
  "data": {
    "stage": "prepared",
    "style_id": "Aix0092",
    "style_name": "深蓝巨手",
    "style_version": "1.0.0",
    "thumbnail_path": "styles/Aix0092/thumbnail.webp",
    "target": "generic-text-v1",
    "mode": "generate",
    "strength": "balanced",
    "final_prompt": "画面内容：蓝色海面上，一只透明巨手托起一艘小船\n必须保留：海面；小船\n视觉风格：平滑数字渲染，圆润曲线和半透明材质；深蓝单色体系配纯白工具或高光；巨大曲线形体与小型实体形成对角互动；柔和渐层高光，透明边缘与实体轮廓清楚；塑料或陶瓷般平滑表面，少量光泽\n画幅比例：2:3\n避免出现：粗糙版画和强颗粒；多色复杂霓虹；乱码文字与伪文字",
    "negative_prompt": null,
    "requested_parameters": {
      "aspect_ratio": "2:3"
    },
    "tool_parameters": {},
    "applied_feature_ids": [
      "F01",
      "F02",
      "F03",
      "F04",
      "F05"
    ],
    "omitted_features": [],
    "omitted_avoid": [],
    "provenance": {
      "style_id": "Aix0092",
      "style_version": "1.0.0",
      "library_version": "0.4.1",
      "content_hash": "57cd77f2119b84b735ce85dafaf15412ac7c8f5fc7165c6807a6ba6d2380952e"
    }
  },
  "warnings": [],
  "meta": {
    "library_version": "0.4.1",
    "execution_mode": "script",
    "elapsed_ms": 1
  }
}