{
  "api_version": "1.0",
  "operation": "prepare",
  "status": "ok",
  "code": "OK",
  "message": "命令成功。",
  "data": {
    "stage": "prepared",
    "style_id": "Aix0030",
    "style_name": "紫红渐变剪影",
    "style_version": "1.0.0",
    "thumbnail_path": "styles/Aix0030/thumbnail.webp",
    "target": "generic-text-v1",
    "mode": "generate",
    "strength": "balanced",
    "final_prompt": "画面内容：一个人坐在窗边看夕阳里的钟楼\n必须保留：窗边的人；钟楼\n视觉风格：框式构图，以窗框为界分割内外空间；室内深紫暗调与窗外洋红橙色渐变的对比；背光剪影，强调轮廓而非细节；矢量平涂，几何感简洁；干净无纹理\n画幅比例：2:3\n避免出现：写实细节；粗糙噪点；乱码文字与伪文字",
    "negative_prompt": null,
    "requested_parameters": {
      "aspect_ratio": "2:3"
    },
    "tool_parameters": {},
    "applied_feature_ids": [
      "F01",
      "F02",
      "F03",
      "F04",
      "F05"
    ],
    "omitted_features": [],
    "omitted_avoid": [],
    "provenance": {
      "style_id": "Aix0030",
      "style_version": "1.0.0",
      "library_version": "0.3.2",
      "content_hash": "da0dd61ccf80f0ae8c74ff0720a958bfc82c42efa148f9bc7c3fbaf70c0c55ee"
    }
  },
  "warnings": [],
  "meta": {
    "library_version": "0.3.2",
    "execution_mode": "script",
    "elapsed_ms": 1
  }
}