{
  "api_version": "1.0",
  "operation": "prepare",
  "status": "ok",
  "code": "OK",
  "message": "命令成功。",
  "data": {
    "stage": "prepared",
    "style_id": "Aix0072",
    "style_name": "紫涡藏面",
    "style_version": "1.0.0",
    "thumbnail_path": "styles/Aix0072/thumbnail.webp",
    "target": "generic-text-v1",
    "mode": "generate",
    "strength": "balanced",
    "final_prompt": "画面内容：白桌上的黑色收音机被一圈紫光包住\n必须保留：收音机；紫光\n视觉风格：锐利数字矢量平涂，几何边缘干净；黑白二色为骨架，单一紫色作为高饱和锚点；垂直分割与局部圆形漩涡形成正负形对照；无复杂光影，以黑白明度和紫色块面分层；黑色区域带细密星尘颗粒，其他区域保持平整\n画幅比例：2:3\n避免出现：丰富渐变与写实皮肤；多色装饰与拥挤背景；乱码文字与伪文字",
    "negative_prompt": null,
    "requested_parameters": {
      "aspect_ratio": "2:3"
    },
    "tool_parameters": {},
    "applied_feature_ids": [
      "F01",
      "F02",
      "F03",
      "F04",
      "F05"
    ],
    "omitted_features": [],
    "omitted_avoid": [],
    "provenance": {
      "style_id": "Aix0072",
      "style_version": "1.0.0",
      "library_version": "0.4.1",
      "content_hash": "b06fe247700317250e894a403f4832269fb0c9a86dff969f170afa9dc08d1645"
    }
  },
  "warnings": [],
  "meta": {
    "library_version": "0.4.1",
    "execution_mode": "script",
    "elapsed_ms": 1
  }
}