{
  "api_version": "1.0",
  "operation": "prepare",
  "status": "ok",
  "code": "OK",
  "message": "命令成功。",
  "data": {
    "stage": "prepared",
    "style_id": "Aix0059",
    "style_name": "黑白蝶化升腾",
    "style_version": "1.0.0",
    "thumbnail_path": "styles/Aix0059/thumbnail.webp",
    "target": "generic-text-v1",
    "mode": "generate",
    "strength": "balanced",
    "final_prompt": "画面内容：被锁链缠绕的人坐着，头顶飞散出成群黑蝶\n必须保留：锁链坐姿；黑蝶群\n视觉风格：黑白墨水排线结合版画质感；全黑白灰高对比；垂直构图，主体上下升腾动势；高对比明暗，黑密白疏；繁复排线与颗粒\n画幅比例：2:3\n避免出现：彩色元素；光滑数字；乱码文字与伪文字",
    "negative_prompt": null,
    "requested_parameters": {
      "aspect_ratio": "2:3"
    },
    "tool_parameters": {},
    "applied_feature_ids": [
      "F01",
      "F02",
      "F03",
      "F04",
      "F05"
    ],
    "omitted_features": [],
    "omitted_avoid": [],
    "provenance": {
      "style_id": "Aix0059",
      "style_version": "1.0.0",
      "library_version": "0.3.2",
      "content_hash": "8f03735a729a7799356e7bee8f20255203f43e17468303bdd60bc1b3bc641a64"
    }
  },
  "warnings": [],
  "meta": {
    "library_version": "0.3.2",
    "execution_mode": "script",
    "elapsed_ms": 1
  }
}