{
  "api_version": "1.0",
  "operation": "prepare",
  "status": "ok",
  "code": "OK",
  "message": "命令成功。",
  "data": {
    "stage": "prepared",
    "style_id": "Aix0028",
    "style_name": "荧光绿霓虹夜行",
    "style_version": "1.0.0",
    "thumbnail_path": "styles/Aix0028/thumbnail.webp",
    "target": "generic-text-v1",
    "mode": "generate",
    "strength": "balanced",
    "final_prompt": "画面内容：霓虹灯管盘成的路牌在夜里发绿光\n必须保留：霓虹路牌\n视觉风格：黑底配荧光绿与紫罗兰霓虹光；路灯投射的长光束与雾气晕染；一点透视的纵深街道，视线被引向远方；数字绘画，光效柔化与硬边剪影结合；地面湿滑反光与雾气质感\n画幅比例：2:3\n避免出现：日光暖调；写实街拍；乱码文字与伪文字",
    "negative_prompt": null,
    "requested_parameters": {
      "aspect_ratio": "2:3"
    },
    "tool_parameters": {},
    "applied_feature_ids": [
      "F01",
      "F02",
      "F03",
      "F04",
      "F05"
    ],
    "omitted_features": [],
    "omitted_avoid": [],
    "provenance": {
      "style_id": "Aix0028",
      "style_version": "1.0.0",
      "library_version": "0.3.2",
      "content_hash": "7f8831e38c1d0985ee1d8781001a5bab0da4116132e6a9245a1527631f2a057f"
    }
  },
  "warnings": [],
  "meta": {
    "library_version": "0.3.2",
    "execution_mode": "script",
    "elapsed_ms": 1
  }
}