{
  "api_version": "1.0",
  "operation": "prepare",
  "status": "ok",
  "code": "OK",
  "message": "命令成功。",
  "data": {
    "stage": "prepared",
    "style_id": "Aix0020",
    "style_name": "表里分割叙事",
    "style_version": "1.0.0",
    "thumbnail_path": "styles/Aix0020/thumbnail.webp",
    "target": "generic-text-v1",
    "mode": "generate",
    "strength": "balanced",
    "final_prompt": "画面内容：渡船上的人望向灰雾水面，水下红光涌动\n必须保留：渡船人；水下红光\n视觉风格：水平分割构图：画面上部与下部呈现对比鲜明的两个世界；上部低饱和灰白冷调，下部深黑底上高饱和珊瑚红与亮红；上部柔和漫射光，下部自发光式红光由下向上渗透；喷枪与粉彩式数字绘画，硬边剪影与柔和过渡并存；通体颗粒噪点，粗糙纸面质感\n画幅比例：2:3\n避免出现：明亮均一的色调；光滑无纹理的渲染与写实照片质感；乱码文字与伪文字印章",
    "negative_prompt": null,
    "requested_parameters": {
      "aspect_ratio": "2:3"
    },
    "tool_parameters": {},
    "applied_feature_ids": [
      "F01",
      "F02",
      "F03",
      "F04",
      "F05"
    ],
    "omitted_features": [],
    "omitted_avoid": [],
    "provenance": {
      "style_id": "Aix0020",
      "style_version": "1.0.0",
      "library_version": "0.2.0",
      "content_hash": "5d05529af94a01e2871b20bd5898fe6760b7194ddfc53aa4b1cb1e2a419b55bf"
    }
  },
  "warnings": [],
  "meta": {
    "library_version": "0.2.0",
    "execution_mode": "script",
    "elapsed_ms": 1
  }
}