{
  "api_version": "1.0",
  "operation": "prepare",
  "status": "ok",
  "code": "OK",
  "message": "命令成功。",
  "data": {
    "stage": "prepared",
    "style_id": "Aix0085",
    "style_name": "冷灰叠面",
    "style_version": "1.0.0",
    "thumbnail_path": "styles/Aix0085/thumbnail.webp",
    "target": "generic-text-v1",
    "mode": "generate",
    "strength": "balanced",
    "final_prompt": "画面内容：穿风衣的人站在雾中，脸部由轻微错位的轮廓组成\n必须保留：风衣人物；错位轮廓\n视觉风格：细腻数字线稿与平滑渐层，形体边缘连续；灰蓝、苍白与中性灰组成低饱和冷色体系；垂直肖像集中于上半部，重复轮廓形成层叠焦点；柔和漫射光，避免强烈硬阴影；皮肤与织物的细腻数字质感，轻微雾化\n画幅比例：2:3\n避免出现：高饱和商业色；粗糙版画颗粒；乱码文字与伪文字",
    "negative_prompt": null,
    "requested_parameters": {
      "aspect_ratio": "2:3"
    },
    "tool_parameters": {},
    "applied_feature_ids": [
      "F01",
      "F02",
      "F03",
      "F04",
      "F05"
    ],
    "omitted_features": [],
    "omitted_avoid": [],
    "provenance": {
      "style_id": "Aix0085",
      "style_version": "1.0.0",
      "library_version": "0.4.1",
      "content_hash": "babadc3444723553da728034f44ba10d92689d76d31d395e4b1d02a5f869762c"
    }
  },
  "warnings": [],
  "meta": {
    "library_version": "0.4.1",
    "execution_mode": "script",
    "elapsed_ms": 1
  }
}