{
  "api_version": "1.0",
  "operation": "prepare",
  "status": "ok",
  "code": "OK",
  "message": "命令成功。",
  "data": {
    "stage": "prepared",
    "style_id": "Aix0004",
    "style_name": "水墨写意",
    "style_version": "1.0.0",
    "thumbnail_path": "styles/Aix0004/thumbnail.webp",
    "target": "generic-text-v1",
    "mode": "generate",
    "strength": "balanced",
    "final_prompt": "画面内容：一位执伞的少女走过雨中的石桥，衣袂与伞面用寥寥数笔\n必须保留：执伞少女；石桥\n视觉风格：宣纸水墨绘制，墨色随水渗化、边缘自然晕开；墨色浓淡层次为主，点缀极少量淡赭、花青等低饱和色；毛笔线条有提按顿挫，笔意松弛不僵硬；大面积留白，主体偏置于一侧，空间疏朗\n画幅比例：2:3\n避免出现：鲜艳荧光色与数字渐变；均匀厚涂与强调立体感的西式光影",
    "negative_prompt": null,
    "requested_parameters": {
      "aspect_ratio": "2:3"
    },
    "tool_parameters": {},
    "applied_feature_ids": [
      "F01",
      "F02",
      "F03",
      "F04"
    ],
    "omitted_features": [],
    "omitted_avoid": [],
    "provenance": {
      "style_id": "Aix0004",
      "style_version": "1.0.0",
      "library_version": "0.2.0",
      "content_hash": "4d06ac26f47cd696e29d43057c537a4944e1d7a659491618268e175e439d52b0"
    }
  },
  "warnings": [],
  "meta": {
    "library_version": "0.2.0",
    "execution_mode": "script",
    "elapsed_ms": 1
  }
}