{
  "api_version": "1.0",
  "operation": "prepare",
  "status": "ok",
  "code": "OK",
  "message": "命令成功。",
  "data": {
    "stage": "prepared",
    "style_id": "Aix0123",
    "style_name": "黑洞捧持",
    "style_version": "1.0.0",
    "thumbnail_path": "styles/Aix0123/thumbnail.webp",
    "target": "generic-text-v1",
    "mode": "generate",
    "strength": "balanced",
    "final_prompt": "画面内容：远景以捧持黑洞与同心圆作为主结构，采用灰黑白的构图秩序，把拥抱虚无与隐藏自我转译成环境叙事。\n必须保留：灰黑白；圆形中心\n视觉风格：极简平涂与轻颗粒结合，几何边缘必须干净。；灰、黑、白三色分层，中心黑洞拥有最高对比。；双手围绕圆形核心，头部遮挡形成第二个矩形负形。；均匀平光，依靠圆形层级与黑白关系塑造空间。；细微纸面颗粒和套印感，不加入写实材质。\n画幅比例：2:3\n避免出现：复杂多色背景；写实人物表情；乱码文字与伪文字",
    "negative_prompt": null,
    "requested_parameters": {
      "aspect_ratio": "2:3"
    },
    "tool_parameters": {},
    "applied_feature_ids": [
      "F01",
      "F02",
      "F03",
      "F04",
      "F05"
    ],
    "omitted_features": [],
    "omitted_avoid": [],
    "provenance": {
      "style_id": "Aix0123",
      "style_version": "1.0.0",
      "library_version": "0.6.0",
      "content_hash": "1ff6f6c1b334b4ca700bdfd614772bdff4de1d900724f4865d3e750089c7c911"
    }
  },
  "warnings": [],
  "meta": {
    "library_version": "0.6.0",
    "execution_mode": "script",
    "elapsed_ms": 1
  }
}