{
  "api_version": "1.0",
  "operation": "prepare",
  "status": "ok",
  "code": "OK",
  "message": "命令成功。",
  "data": {
    "stage": "prepared",
    "style_id": "Aix0154",
    "style_name": "赤日分镜",
    "style_version": "1.0.0",
    "thumbnail_path": "styles/Aix0154/thumbnail.webp",
    "target": "generic-text-v1",
    "mode": "generate",
    "strength": "balanced",
    "final_prompt": "画面内容：在灰黑高楼街口中，一个人物以清晰轮廓面对红日与城市分镜，保持红黑灰，表现城市秩序与末日焦虑。\n必须保留：红黑灰；分镜切割\n视觉风格：硬边漫画色块，建筑和人物采用清晰剪影，不堆积写实细节。；灰黑基底上只保留红色天空或太阳作为视觉主色。；分镜框或建筑切面形成多段视线，侧脸作为局部叙事锚点。；平面暮光，无复杂云层和摄影渐变。；粗糙纸面、套印颗粒和少量墨线。\n画幅比例：2:3\n避免出现：完整对白气泡；多彩卡通装饰；乱码文字与伪文字",
    "negative_prompt": null,
    "requested_parameters": {
      "aspect_ratio": "2:3"
    },
    "tool_parameters": {},
    "applied_feature_ids": [
      "F01",
      "F02",
      "F03",
      "F04",
      "F05"
    ],
    "omitted_features": [],
    "omitted_avoid": [],
    "provenance": {
      "style_id": "Aix0154",
      "style_version": "1.0.0",
      "library_version": "0.6.0",
      "content_hash": "6221843357e88f1b26a1700850403708a09262f26c0818b163dd19b14f56abfe"
    }
  },
  "warnings": [],
  "meta": {
    "library_version": "0.6.0",
    "execution_mode": "script",
    "elapsed_ms": 1
  }
}