{
  "api_version": "1.0",
  "operation": "prepare",
  "status": "ok",
  "code": "OK",
  "message": "命令成功。",
  "data": {
    "stage": "prepared",
    "style_id": "Aix0042",
    "style_name": "蓝紫夜读时光",
    "style_version": "1.0.0",
    "thumbnail_path": "styles/Aix0042/thumbnail.webp",
    "target": "generic-text-v1",
    "mode": "generate",
    "strength": "balanced",
    "final_prompt": "画面内容：深夜的唱片店橱窗，灯还亮着\n必须保留：唱片店；橱窗\n视觉风格：赛璐璐平涂结合硬朗线稿，动画美术质感；蓝紫冷调室内与暖黄灯光对比；室内局部暖光，窗外冷月光辅衬；中心构图，环境细节围绕主体堆叠；轻微复古噪点，织物与纸页质感\n画幅比例：2:3\n避免出现：强霓虹；写实厚涂；乱码文字与伪文字",
    "negative_prompt": null,
    "requested_parameters": {
      "aspect_ratio": "2:3"
    },
    "tool_parameters": {},
    "applied_feature_ids": [
      "F01",
      "F02",
      "F03",
      "F04",
      "F05"
    ],
    "omitted_features": [],
    "omitted_avoid": [],
    "provenance": {
      "style_id": "Aix0042",
      "style_version": "1.0.0",
      "library_version": "0.3.2",
      "content_hash": "09358815106d75293726c0700af296763af29f2b9628e3ed65cc1e01a184d524"
    }
  },
  "warnings": [],
  "meta": {
    "library_version": "0.3.2",
    "execution_mode": "script",
    "elapsed_ms": 1
  }
}