{
  "api_version": "1.0",
  "operation": "prepare",
  "status": "ok",
  "code": "OK",
  "message": "命令成功。",
  "data": {
    "stage": "prepared",
    "style_id": "Aix0093",
    "style_name": "彩烟思绪",
    "style_version": "1.0.0",
    "thumbnail_path": "styles/Aix0093/thumbnail.webp",
    "target": "generic-text-v1",
    "mode": "generate",
    "strength": "balanced",
    "final_prompt": "画面内容：小提琴手演奏时，音符化成一团向上流动的彩烟\n必须保留：小提琴手；彩烟\n视觉风格：细腻数字厚涂，烟雾层次柔和且有方向；深蓝黑底中混合蓝、黄、橙、紫的高饱和彩烟；主体位于下方，烟雾向上侧扩散占据主要空间；烟雾内部柔和发光，人物保持较暗；半透明体积烟雾与细腻笔触并存\n画幅比例：2:3\n避免出现：纯平无层次色块；空白无叙事背景；乱码文字与伪文字",
    "negative_prompt": null,
    "requested_parameters": {
      "aspect_ratio": "2:3"
    },
    "tool_parameters": {},
    "applied_feature_ids": [
      "F01",
      "F02",
      "F03",
      "F04",
      "F05"
    ],
    "omitted_features": [],
    "omitted_avoid": [],
    "provenance": {
      "style_id": "Aix0093",
      "style_version": "1.0.0",
      "library_version": "0.4.1",
      "content_hash": "9c438a860b53158702f5fdd2e0c918f55b31f7b4f9c3213b161919184144dba9"
    }
  },
  "warnings": [],
  "meta": {
    "library_version": "0.4.1",
    "execution_mode": "script",
    "elapsed_ms": 2
  }
}