{
  "api_version": "1.0",
  "operation": "prepare",
  "status": "ok",
  "code": "OK",
  "message": "命令成功。",
  "data": {
    "stage": "prepared",
    "style_id": "Aix0126",
    "style_name": "赤室孤灯",
    "style_version": "1.0.0",
    "thumbnail_path": "styles/Aix0126/thumbnail.webp",
    "target": "generic-text-v1",
    "mode": "generate",
    "strength": "balanced",
    "final_prompt": "画面内容：在深夜工作室中，一个人物以清晰轮廓面对深红室内与孤灯，保持深红底色，表现专注动作与压抑环境。\n必须保留：深红底色；单一暖光\n视觉风格：粗犷手绘数字厚涂，人物和家具用概括笔触，不追求摄影写实。；深红背景、黑褐暗部和暖黄色光源形成强烈局部对比。；台灯光圈集中在桌面，四周暗部包围单一动作中心。；单一暖光源切出手和纸面，避免多色光污染。；粗刷痕、厚薄交错和轻微颗粒保留手工感。\n画幅比例：2:3\n避免出现：洁白商业室内；多光源炫技；乱码文字与伪文字",
    "negative_prompt": null,
    "requested_parameters": {
      "aspect_ratio": "2:3"
    },
    "tool_parameters": {},
    "applied_feature_ids": [
      "F01",
      "F02",
      "F03",
      "F04",
      "F05"
    ],
    "omitted_features": [],
    "omitted_avoid": [],
    "provenance": {
      "style_id": "Aix0126",
      "style_version": "1.0.0",
      "library_version": "0.6.0",
      "content_hash": "1bf0588d02bfc60ffcdce3aa371ea4ba9fce6be58993c8cfd841f207a2610f72"
    }
  },
  "warnings": [],
  "meta": {
    "library_version": "0.6.0",
    "execution_mode": "script",
    "elapsed_ms": 1
  }
}